Pokedex Entry,Number,Name
A strange seed was planted on its back at birth. The plant sprouts and grows with this POKéMON.,#001,Bulbasaur
"Very protective of its sprawling territorial area, this POKéMON will fiercely peck at any intruder.",#017,Pidgeotto
A common sight in forests and woods. It flaps its wings at ground level to kick up blinding sand.,#016,Pidgey
Flies at high speed and attacks using its large venomous stingers on its forelegs and tail.,#015,Beedrill
"Almost incapable of moving, this POKéMON can only harden its shell to protect itself from predators.",#014,Kakuna
"Often found in forests, eating leaves. It has a sharp venomous stinger on its head.",#013,Weedle
"In battle, it flaps its wings at high speed to release highly toxic dust into the air.",#012,Butterfree
"This POKéMON is vulnerable to attack while its shell is soft, exposing its weak and tender body.",#011,Metapod
Its short feet are tipped with suction pads that enable it to tirelessly climb slopes and walls.,#010,Caterpie
A brutal POKéMON with pressurized water jets on its shell. They are used for high speed tackles.,#009,Blastoise
"Often hides in water to stalk unwary prey. For swimming fast, it moves its ears to maintain balance.",#008,Wartortle
"After birth, its back swells and hardens into a shell. Powerfully sprays foam from its mouth.",#007,Squirtle
Spits fire that is hot enough to melt boulders. Known to cause forest fires unintentionally.,#006,Charizard
"When it swings its burning tail, it elevates the temperature to unbearably high levels.",#005,Charmeleon
"Obviously prefers hot places. When it rains, steam is said to spout from the tip of its tail.",#004,Charmander
The plant blooms when it is absorbing solar energy. It stays on the move to seek sunlight.,#003,Venusaur
"It electrifies its claws and tears its opponents apart with them. Even if they dodge its attack, they’ll be electrocuted by the flying sparks.",#807,Zeraora
"It slithers toward people. Then, without warning, it triggers the explosion of its own head. It’s apparently one kind of Ultra Beast.",#806,Blacephalon
It appeared from an Ultra Wormhole. Each one appears to be made up of many life-forms stacked one on top of each other.,#805,Stakataka
It stores hundreds of liters of poisonous liquid inside its body. It is one of the organisms known as UBs.,#804,Naganadel
This Ultra Beast is well enough liked to be chosen as a first partner in its own world.,#803,Poipole
"Able to conceal itself in shadows, it never appears before humans, so its very existence was the stuff of myth.",#802,Marshadow
"This artificial Pokémon, constructed more than 500 years ago, can understand human speech but cannot itself speak.",#801,Magearna
"Reminiscent of the Ultra Beasts, this life-form, apparently asleep underground, is thought to have come from another world in ancient times.",#800,Necrozma
"It has gobbled mountains and swallowed whole buildings, according to reports. It’s one of the Ultra Beasts.",#799,Guzzlord
"This Ultra Beast came from the Ultra Wormhole. It seems not to attack enemies on its own, but its sharp body is a dangerous weapon in itself.",#798,Kartana
It appeared from the Ultra Wormhole. Witnesses observed it flying across the sky at high speed.,#797,Celesteela
"One of the mysterious life-forms known as Ultra Beasts. Astonishing electric shocks emanate from its entire body, according to witnesses.",#796,Xurkitree
"One of the dangerous Ultra Beasts, it has been spotted running across the land at terrific speeds.",#795,Pheromosa
"This Ultra Beast appeared from another world. It shows off its body, but whether that display is a boast or a threat remains unclear.",#794,Buzzwole
One of several mysterious Ultra Beasts. People on the street report observing those infested by it suddenly becoming violent.,#793,Nihilego
"It is said to be a female evolution of Cosmog. When its third eye activates, away it flies to another world.",#792,Lunala
It is said to live in another world. The intense light it radiates from the surface of its body can make the darkest of nights light up like midday.,#791,Solgaleo
"Motionless as if dead, its body is faintly warm to the touch. In the distant past, it was called the cocoon of the stars.",#790,Cosmoem
The dense fog it creates brings the downfall and destruction of its confused enemies. Ocean currents are the source of its energy.,#788,Tapu Fini
Its body is gaseous and frail. It slowly grows as it collects dust from the atmosphere.,#789,Cosmog
"It pulls large trees up by the roots and swings them around. It causes vegetation to grow, and then it absorbs energy from the growth.",#787,Tapu Bulu
This guardian deity of Akala is guilelessly cruel. The fragrant aroma of flowers is the source of its energy.,#786,Tapu Lele
This guardian deity of Melemele is brimming with curiosity. It summons thunderclouds and stores their lightning inside its body.,#785,Tapu Koko
"When it spots enemies, it threatens them by jingling the scales on its tail. Weak opponents will crack and flee in panic.",#784,Kommo-o
It leaps at its prey with a courageous shout. Its scaly punches tear its opponents to shreds.,#783,Hakamo-o
It expresses its feelings by smacking its scales. Metallic sounds echo through the tall mountains where Jangmo-o lives.,#782,Jangmo-o
"Swinging its massive anchor, it can KO Wailord in a single blow. What appears to be green seaweed is actually its body.",#781,Dhelmise
"It has a compassionate personality, but if it is angered, it completely destroys its surroundings with its intense breath.",#780,Drampa
"When it unleashes its psychic power from the protuberance on its head, the grating sound of grinding teeth echoes through the area.",#779,Bruxish
Its actual appearance is unknown. A scholar who saw what was under its rag was overwhelmed by terror and died from the shock.,#778,Mimikyu
"The spiny fur on its back is normally at rest. When this Pokémon becomes agitated, its fur stands on end and stabs into its attackers.",#777,Togedemaru
The shell on its back is chemically unstable and explodes violently if struck. The hole in its stomach is its weak point.,#776,Turtonator
"It is born asleep, and it dies asleep. All its movements are apparently no more than the results of it tossing and turning in its dreams.",#775,Komala
"Originally making its home in the ozone layer, it hurtles to the ground when the shell enclosing its body grows too heavy.",#774,Minior
"Its trust in its partner is what awakens it. This Pokémon is capable of changing its type, a flexibility that is well displayed in battle.",#773,Silvally
The heavy control mask it wears suppresses its intrinsic capabilities. This Pokémon has some hidden special power.,#772,Type: Null
"It lives in shallow seas, such as areas near a beach. It can eject its internal organs, which it uses to engulf its prey or battle enemies.",#771,Pyukumuku
"Possessed people controlled by this Pokémon transformed its sand mound into a castle. As it evolved, its power to curse grew ever stronger.",#770,Palossand
"Born from a sand mound playfully built by a child, this Pokémon embodies the grudges of the departed.",#769,Sandygast
"With a flashing slash of its giant sharp claws, it cleaves seawater—or even air—right in two.",#768,Golisopod
"This Pokémon is a coward. As it desperately dashes off, the flailing of its many legs leaves a sparkling clean path in its wake.",#767,Wimpod
They form groups of roughly 20 individuals. Their mutual bond is remarkable—they will never let down a comrade.,#766,Passimian
"Known for its extreme intelligence, this Pokémon will look down on inexperienced Trainers, so it’s best suited to veteran Trainers.",#765,Oranguru
"It attaches flowers to its highly nutritious vine. This revitalizes the flowers, and they give off an aromatic scent.",#764,Comfey
"Its long, striking legs aren’t just for show but to be used to kick with skill. In victory, it shows off by kicking the defeated, laughing boisterously.",#763,Tsareena
"The sepals on its head developed to protect its body. These are quite hard, so even if pecked by bird Pokémon, this Pokémon is totally fine.",#762,Steenee
A delectable aroma pours from its body. They are often swallowed whole by Toucannon lured by that wafting deliciousness.,#761,Bounsweet
This immensely dangerous Pokémon possesses overwhelming physical strength. Its habitat is generally off-limits.,#760,Bewear
"Despite its adorable appearance, when it gets angry and flails about, its arms and legs could knock a pro wrestler sprawling.",#759,Stufful
"For some reason, only females have been found. It creates a reverse harem of male Salandit that it lives with.",#758,Salazzle
"It burns its bodily fluids to create a poisonous gas. When its enemies become disoriented from inhaling the gas, it attacks them.",#757,Salandit
Forests where Shiinotic live are treacherous to enter at night. People confused by its strange lights can never find their way home again.,#756,Shiinotic
It scatters spores that flicker and glow. Anyone seeing these lights falls into a deep slumber.,#755,Morelull
"It requires a lot of effort to maintain Lurantis’s vivid coloring, but some collectors enjoy this work and treat it as their hobby.",#754,Lurantis
"During the day, it sleeps and soaks up light. When night falls, it walks around looking for a safer place to sleep.",#753,Fomantis
"It delivers headbutts with the water bubble on its head. Small Pokémon get sucked into the bubble, where they drown.",#752,Araquanid
It crawls onto the land in search of food. Its water bubble allows it to breathe and protects its soft head.,#751,Dewpider
"It spits a mud that provides resistance to both wind and rain, so the walls of old houses were often coated with it.",#750,Mudsdale
The mud stuck to Mudbray’s hooves enhances its grip and its powerful running gait.,#749,Mudbray
Toxapex crawls along the ocean floor on its 12 legs. It leaves a trail of Corsola bits scattered in its wake.,#748,Toxapex
"It plunges the poison spike on its head into its prey. When the prey has weakened, Mareanie deals the finishing blow with its 10 tentacles.",#747,Mareanie
"When it’s in trouble, its eyes moisten and begin to shine. The shining light attracts its comrades, and they stand together against their enemies.",#746,Wishiwashi
"Its quick movements confuse its enemies. Well equipped with claws and fangs, it also uses the sharp rocks in its mane as weapons.",#745,Lycanroc
"It’s considered to be a good Pokémon for beginners because of its friendliness, but its disposition grows rougher as it grows up.",#744,Rockruff
"It rolls up pollen into puffs. It makes many different varieties, some used as food and others used in battle.",#743,Ribombee
"It feeds on the nectar and pollen of flowers. Because it’s able to sense auras, it can identify which flowers are about to bloom.",#742,Cutiefly
"It beats its wings together to create fire. As it moves in the steps of its beautiful dance, it bathes opponents in intense flames.",#741,Oricorio
"It aimed for the top but got lost and ended up on a snowy mountain. Being forced to endure the cold, this Pokémon evolved and grew fur.",#740,Crabominable
"While guarding its weak points with its pincers, it looks for an opening and unleashes punches. When it loses, it foams at the mouth and faints.",#739,Crabrawler
"It zips around, on sharp lookout for an opening. It concentrates electrical energy within its large jaws and uses it to zap its enemies.",#738,Vikavolt
"Its body is capable of storing electricity. On camping trips, people are grateful to have one around.",#737,Charjabug
Its strong jaw enables it to scrape trees and slurp out the sap. It normally lives underground.,#736,Grubbin
"When it finds a trace of its prey, it patiently stakes out the location...but it’s always snoozing by nightfall.",#735,Gumshoos
"With its sharp fangs, it will bite anything. It did not originally live in Alola but was imported from another region.",#734,Yungoos
"When it battles, its beak heats up. The temperature can easily exceed 212 degrees Fahrenheit, causing severe burns when it hits.",#733,Toucannon
"It eats berries and stores their seeds in its beak. When it encounters enemies or prey, it fires off all the seeds in a burst.",#732,Trumbeak
It can peck at a rate of 16 times a second to drill holes in trees. It uses the holes for food storage and for nesting.,#731,Pikipek
It controls its water balloons with song. The melody is learned from others of its kind and is passed down from one generation to the next.,#730,Primarina
"A skillful dancer, it creates a sequence of water balloons as it dances, and briskly bombards its enemies.",#729,Brionne
"This Pokémon snorts body fluids from its nose, blowing balloons to smash into its foes. It’s famous for being a hard worker.",#728,Popplio
"This Pokémon has a violent, selfish disposition. If it’s not in the mood to listen, it will ignore its Trainer’s orders with complete nonchalance.",#727,Incineroar
"At its throat, it bears a bell of fire. The bell rings brightly whenever this Pokémon spits fire.",#726,Torracat
"While grooming itself, it builds up fur inside its stomach. It sets the fur alight and spews fiery attacks, which change based on how it coughs.",#725,Litten
"It fires arrow quills from its wings with such precision, they can pierce a pebble at distances over a hundred yards.",#724,Decidueye
"A bit of a dandy, it spends its free time preening its wings. Its preoccupation with any dirt on its plumage can leave it unable to battle.",#723,Dartrix
"This wary Pokémon uses photosynthesis to store up energy during the day, while becoming active at night.",#722,Rowlet
It lets out billows of steam and disappears into the dense fog. It’s said to live in mountains where humans do not tread.,#721,Volcanion
"This troublemaker sends anything and everything to faraway places using its loop, which can warp space.",#720,Hoopa
"A sudden transformation of Carbink, its pink, glimmering body is said to be the loveliest sight in the whole world.",#719,Diancie
"When the Kalos region’s ecosystem falls into disarray, it appears and reveals its secret power.",#718,Zygarde
"When this legendary Pokémon’s wings and tail feathers spread wide and glow red, it absorbs the life force of living creatures.",#717,Yveltal
Legends say it can share eternal life. It slept for a thousand years in the form of a tree before its revival.,#716,Xerneas
They fly around on moonless nights and attack careless prey. Nothing can beat them in a battle in the dark.,#715,Noivern
"They live in pitch-black caves. Their enormous ears can emit ultrasonic waves of 200,000 hertz.",#714,Noibat
Its ice-covered body is as hard as steel. Its cumbersome frame crushes anything that stands in its way.,#713,Avalugg
It blocks opponents’ attacks with the ice that shields its body. It uses cold air to repair any cracks with new ice.,#712,Bergmite
"Singing in eerie voices, they wander town streets on the night of the new moon. Anyone who hears their song is cursed.",#711,Gourgeist
"The pumpkin body is inhabited by a spirit trapped in this world. As the sun sets, it becomes restless and active.",#710,Pumpkaboo
"It can control trees at will. It will trap people who harm the forest, so they can never leave.",#709,Trevenant
These Pokémon are created when spirits possess rotten tree stumps. They prefer to live in abandoned forests.,#708,Phantump
These key collectors threaten any attackers by fiercely jingling their keys at them.,#707,Klefki
"This very friendly Dragon-type Pokémon will hug its beloved Trainer, leaving that Trainer covered in sticky slime.",#706,Goodra
"It drives away opponents by excreting a sticky liquid that can dissolve anything. Its eyes devolved, so it can’t see anything.",#705,Sliggoo
"The weakest Dragon-type Pokémon, it lives in damp, shady places, so its body doesn’t dry out.",#704,Goomy
"Born from the temperatures and pressures deep underground, it fires beams from the stone in its head.",#703,Carbink
"Its whiskers serve as antennas. By sending and receiving electrical waves, it can communicate with others over vast distances.",#702,Dedenne
"Although its body is small, its proficient fighting skills enable it to keep up with big bruisers like Machamp and Hariyama.",#701,Hawlucha
It sends a soothing aura from its ribbonlike feelers to calm fights.,#700,Sylveon
"The diamond-shaped crystals on its body expel air as cold as -240 degrees Fahrenheit, surrounding its enemies and encasing them in ice.",#699,Aurorus
This ancient Pokémon was restored from part of its body that had been frozen in ice for over 100 million years.,#698,Amaura
"Thanks to its gargantuan jaws, which could shred thick metal plates as if they were paper, it was invincible in the ancient world it once inhabited.",#697,Tyrantrum
"This Pokémon was restored from a fossil. If something happens that it doesn’t like, it throws a tantrum and runs wild.",#696,Tyrunt
They flare their frills and generate energy. A single Heliolisk can generate sufficient electricity to power a skyscraper.,#695,Heliolisk
"They make their home in deserts. They can generate their energy from basking in the sun, so eating food is not a requirement.",#694,Helioptile
Their enormous claws launch cannonballs of water powerful enough to pierce tanker hulls.,#693,Clawitzer
They knock down flying prey by firing compressed water from their massive claws like shooting a pistol.,#692,Clauncher
"Their poison is strong enough to eat through the hull of a tanker, and they spit it indiscriminately at anything that enters their territory.",#691,Dragalge
"Camouflaged as rotten kelp, they spray liquid poison on prey that approaches unawares and then finish it off.",#690,Skrelp
"When they evolve, two Binacle multiply into seven. They fight with the power of seven Binacle.",#689,Barbaracle
"Two Binacle live together on one rock. When they fight, one of them will move to a different rock.",#688,Binacle
"It wields the most compelling hypnotic powers of any Pokémon, and it forces others to do whatever it wants.",#687,Malamar
Opponents who stare at the flashing of the light-emitting spots on its body become dazed and lose their will to fight.,#686,Inkay
It can distinguish the faintest of scents. It puts its sensitive sense of smell to use by helping pastry chefs in their work.,#685,Slurpuff
"To entangle its opponents in battle, it extrudes white threads as sweet and sticky as cotton candy.",#684,Swirlix
"It devises various scents, pleasant and unpleasant, and emits scents that its enemies dislike in order to gain an edge in battle.",#683,Aromatisse
It emits a scent that enraptures those who smell it. This fragrance changes depending on what it has eaten.,#682,Spritzee
"Generations of kings were attended by these Pokémon, which used their spectral power to manipulate and control people and Pokémon.",#681,Aegislash
"When Honedge evolves, it divides into two swords, which cooperate via telepathy to coordinate attacks and slash their enemies to ribbons.",#680,Doublade
Apparently this Pokémon is born when a departed spirit inhabits a sword. It attaches itself to people and drinks their life force.,#679,Honedge
"When in danger, it raises its ears and releases enough psychic power to grind a 10-ton truck into dust.",#678,Meowstic
The organ that emits its intense psychic power is sheltered by its ears to keep power from leaking out.,#677,Espurr
Trimming its fluffy fur not only makes it more elegant but also increases the swiftness of its movements.,#676,Furfrou
"Although it possesses a violent temperament, it won’t put up with bullying. It uses the leaf in its mouth to sense the movements of its enemies.",#675,Pangoro
"It does its best to be taken seriously by its enemies, but its glare is not sufficiently intimidating. Chewing on a leaf is its trademark.",#674,Pancham
It can tell how its Trainer is feeling by subtle shifts in the grip on its horns. This empathic sense lets them run as if one being.,#673,Gogoat
"Thought to be one of the first Pokémon to live in harmony with humans, it has a placid disposition.",#672,Skiddo
"It claims exquisite flower gardens as its territory, and it obtains power from basking in the energy emitted by flowering plants.",#671,Florges
It draws out and controls the hidden power of flowers. The flower Flabébé holds is most likely part of its body.,#669,Flabébé
It flutters around fields of flowers and cares for flowers that are starting to wilt. It draws out the hidden power of flowers to battle.,#670,Floette
The male with the largest mane of fire is the leader of the pride.,#668,Pyroar
"The stronger the opponent it faces, the more heat surges from its mane and the more power flows through its body.",#667,Litleo
Vivillon with many different patterns are found all over the world. These patterns are affected by the climate of their habitat.,#666,Vivillon
"It lives hidden within thicket shadows. When predators attack, it quickly bristles the fur covering its body in an effort to threaten them.",#665,Spewpa
"When under attack from bird Pokémon, it spews a poisonous black powder that causes paralysis on contact.",#664,Scatterbug
"In the fever of an exciting battle, it showers embers from the gaps between its feathers and takes to the air.",#663,Talonflame
"From its beak, it expels embers that set the tall grass on fire. Then it pounces on the bewildered prey that pop out of the grass.",#662,Fletchinder
These friendly Pokémon send signals to one another with beautiful chirps and tail-feather movements.,#661,Fletchling
"With their powerful ears, they can heft boulders of a ton or more with ease. They can be a big help at construction sites.",#660,Diggersby
They use their large ears to dig burrows. They will dig the whole night through.,#659,Bunnelby
"It creates throwing stars out of compressed water. When it spins them and throws them at high speed, these stars can split metal in two.",#658,Greninja
"It can throw bubble-covered pebbles with precise control, hitting empty cans up to a hundred feet away.",#657,Frogadier
It secretes flexible bubbles from its chest and back. The bubbles reduce the damage it would otherwise take when attacked.,#656,Froakie
"It gazes into the flame at the tip of its branch to achieve a focused state, which allows it to see into the future.",#655,Delphox
"It has a twig stuck in its tail. With friction from its tail fur, it sets the twig on fire and launches into battle.",#654,Braixen
"Eating a twig fills it with energy, and its roomy ears give vent to air hotter than 390 degrees Fahrenheit.",#653,Fennekin
Its Tackle is forceful enough to flip a 50-ton tank. It shields its allies from danger with its own body.,#652,Chesnaught
It relies on its sturdy shell to deflect predators’ attacks. It counterattacks with its sharp quills.,#651,Quilladin
"The quills on its head are usually soft. When it flexes them, the points become so hard and sharp that they can pierce rock.",#650,Chespin
"Over 300 million years ago, it was feared as the strongest of hunters. It has been modified by Team Plasma.",#649,Genesect
Its melodies are sung with a special vocalization method that can control the feelings of those who hear it.,#648,Meloetta
"By blasting water from its hooves, it can glide across water. It excels at using leg moves while battling.",#647,Keldeo
"It generates a powerful, freezing energy inside itself, but its body became frozen when the energy leaked out.",#646,Kyurem
Lands visited by Landorus grant such bountiful crops that it has been hailed as “The Guardian of the Fields.”,#645,Landorus
"Concealing itself in lightning clouds, it flies throughout the Unova region. It creates electricity in its tail.",#644,Zekrom
"This Pokémon appears in legends. It sends flames into the air from its tail, burning up everything around it.",#643,Reshiram
Countless charred remains mar the landscape of places through which Thundurus has passed.,#642,Thundurus
The lower half of its body is wrapped in a cloud of energy. It zooms through the sky at 200 mph.,#641,Tornadus
This Pokémon fought humans in order to protect its friends. Legends about it continue to be passed down.,#640,Virizion
This Pokémon came to the defense of Pokémon that had lost their homes in a war among humans.,#639,Terrakion
This legendary Pokémon battled against humans to protect Pokémon. Its personality is calm and composed.,#638,Cobalion
"When volcanic ash darkened the atmosphere, it is said that Volcarona’s fire provided a replacement for the sun.",#637,Volcarona
"This Pokémon was believed to have been born from the sun. When it evolves, its entire body is engulfed in flames.",#636,Larvesta
"This brutal Pokémon travels the skies on its six wings. Anything that moves seems like a foe to it, triggering its attack.",#635,Hydreigon
"After it has eaten up all the food in its territory, it moves to another area. Its two heads do not get along.",#634,Zweilous
"It tends to bite everything, and it is not a picky eater. Approaching it carelessly is dangerous.",#633,Deino
"They attack in groups, covering themselves in steel armor to protect themselves from Heatmor.",#632,Durant
It breathes through a hole in its tail while it burns with an internal fire. Durant is its prey.,#631,Heatmor
It makes a nest out of bones it finds. It grabs weakened prey in its talons and hauls it to its nest of bones.,#630,Mandibuzz
"Its wings are too tiny to allow it to fly. As the time approaches for it to evolve, it discards the bones it was wearing.",#629,Vullaby
They fight for their friends without any thought about danger to themselves. One can carry a car while flying.,#628,Braviary
