Pokedex Entry,Number,Name
"It attracts prey with a sweet aroma, then downs it with thorny whips hidden in its arms.",#407,Roserade
"Over the winter, it closes its bud and endures the cold. In spring, the bud opens and releases pollen.",#406,Budew
It has eyes that can see through anything. It spots and captures prey hiding behind objects.,#405,Luxray
Its claws loose electricity with enough amperage to cause fainting. They live in small groups.,#404,Luxio
All of its fur dazzles if danger is sensed. It flees while the foe is momentarily blinded.,#403,Shinx
It crosses its knifelike arms in front of its chest when it cries. It can compose melodies ad lib.,#402,Kricketune
"It shakes its head back to front, causing its antennae to hit each other and sound like a xylophone.",#401,Kricketot
It makes its nest by damming streams with bark and mud. It is known as an industrious worker.,#400,Bibarel
"With nerves of steel, nothing can perturb it. It is more agile and active than it appears.",#399,Bidoof
It has a savage nature. It will courageously challenge foes that are much larger.,#398,Staraptor
It flies around forests and fields in search of bug Pokémon. It stays within a huge flock.,#397,Staravia
"They flock in great numbers. Though small, they flap their wings with great power.",#396,Starly
The three horns that extend from its beak attest to its power. The leader has the biggest horns.,#395,Empoleon
"It lives alone, away from others. Apparently, every one of them believes it is the most important.",#394,Prinplup
"Because it is very proud, it hates accepting food from people. Its thick down guards it from cold.",#393,Piplup
It uses a special kind of martial arts involving all its limbs. Its fire never goes out.,#392,Infernape
"To intimidate attackers, it stretches the fire on its tail to make itself appear bigger.",#391,Monferno
It agilely scales sheer cliffs to live atop craggy mountains. Its fire is put out when it sleeps.,#390,Chimchar
Small Pokémon occasionally gather on its unmoving back to begin building their nests.,#389,Torterra
"Made from soil, the shell on its back hardens when it drinks water. It lives along lakes.",#387,Turtwig
The DNA of a space virus underwent a sudden mutation upon exposure to a laser beam and resulted in DEOXYS. The crystalline organ on this POKéMON’s chest appears to be its brain.,#386,Deoxys
"A legend states that JIRACHI will make true any wish that is written on notes attached to its head when it awakens. If this POKéMON senses danger, it will fight without awakening.",#385,Jirachi
"It lives along water in forests. In the daytime, it leaves the forest to sunbathe its treed shell.",#388,Grotle
"RAYQUAZA lived for hundreds of millions of years in the earth’s ozone layer, never descending to the ground. This POKéMON appears to feed on water and particles in the atmosphere.",#384,Rayquaza
GROUDON has long been described in mythology as the POKéMON that raised lands and expanded continents. This POKéMON took to sleep after a cataclysmic battle with KYOGRE.,#383,Groudon
KYOGRE has the power to create massive rain clouds that cover the entire sky and bring about torrential downpours. This POKéMON saved people who were suffering from droughts.,#382,Kyogre
LATIOS has the ability to make its foe see an image of what it has seen or imagines in its head. This POKéMON is intelligent and understands human speech.,#381,Latios
"LATIAS is highly sensitive to the emotions of people. If it senses any hostility, this POKéMON ruffles the feathers all over its body and cries shrilly to intimidate the foe.",#380,Latias
REGISTEEL has a body that is harder than any kind of metal. Its body is apparently hollow. No one has any idea what this POKéMON eats.,#379,Registeel
"REGICE’s body was made during an ice age. The deep-frozen body can’t be melted, even by fire. This POKéMON controls frigid air of minus 328 degrees F.",#378,Regice
"REGIROCK was sealed away by people long ago. If this POKéMON’s body is damaged in battle, it is said to seek out suitable rocks on its own to repair itself.",#377,Regirock
"METAGROSS has four brains in total. Combined, the four brains can breeze through difficult calculations faster than a supercomputer. This POKéMON can float in the air by tucking in its four legs.",#376,Metagross
"When two BELDUM fuse together, METANG is formed. The brains of the BELDUM are joined by a magnetic nervous system. By linking its brains magnetically, this POKéMON generates strong psychokinetic power.",#375,Metang
"Instead of blood, a powerful magnetic force courses throughout BELDUM’s body. This POKéMON communicates with others by sending controlled pulses of magnetism.",#374,Beldum
"SALAMENCE came about as a result of a strong, long-held dream of growing wings. It is said that this powerful desire triggered a sudden mutation in this POKéMON’s cells, causing it to sprout its magnificent wings.",#373,Salamence
"Inside SHELGON’s armor-like shell, cells are in the midst of transformation to create an entirely new body. This POKéMON’s shell is extremely heavy, making its movements sluggish.",#372,Shelgon
"BAGON has a dream of one day soaring in the sky. In doomed efforts to fly, this POKéMON hurls itself off cliffs. As a result of its dives, its head has grown tough and as hard as tempered steel.",#371,Bagon
LUVDISC live in shallow seas in the tropics. This heart-shaped POKéMON earned its name by swimming after loving couples it spotted in the ocean’s waves.,#370,Luvdisc
RELICANTH is a POKéMON species that existed for a hundred million years without ever changing its form. This ancient POKéMON feeds on microscopic organisms with its toothless mouth.,#369,Relicanth
"GOREBYSS lives in the southern seas at extreme depths. Its body is built to withstand the enormous pressure of water at incredible depths. Because of this, this POKéMON’s body is unharmed by ordinary attacks.",#368,Gorebyss
HUNTAIL’s presence went unnoticed by people for a long time because it lives at extreme depths in the sea. This POKéMON’s eyes can see clearly even in the murky dark depths of the ocean.,#367,Huntail
CLAMPERL’s sturdy shell is not only good for protection - it is also used for clamping and catching prey. A fully grown CLAMPERL’s shell will be scored with nicks and scratches all over.,#366,Clamperl
WALREIN’s two massively developed tusks can totally shatter blocks of ice weighing ten tons with one blow. This POKéMON’s thick coat of blubber insulates it from subzero temperatures.,#365,Walrein
SEALEO has the habit of always juggling on the tip of its nose anything it sees for the first time. This POKéMON occasionally entertains itself by balancing and rolling a SPHEAL on its nose.,#364,Sealeo
"SPHEAL is much faster rolling than walking to get around. When groups of this POKéMON eat, they all clap at once to show their pleasure. Because of this, their mealtimes are noisy.",#363,Spheal
"GLALIE has a body made of rock, which it hardens with an armor of ice. This POKéMON has the ability to freeze moisture in the atmosphere into any shape it desires.",#362,Glalie
"SNORUNT live in regions with heavy snowfall. In seasons without snow, such as spring and summer, this POKéMON steals away to live quietly among stalactites and stalagmites deep in caverns.",#361,Snorunt
"WYNAUT can always be seen with a big, happy smile on its face. Look at its tail to determine if it is angry. When angered, this POKéMON will be slapping the ground with its tail.",#360,Wynaut
"Every time ABSOL appears before people, it is followed by a disaster such as an earthquake or a tidal wave. As a result, it came to be known as the disaster POKéMON.",#359,Absol
"CHIMECHO makes its cries echo inside its hollow body. When this POKéMON becomes enraged, its cries result in ultrasonic waves that have the power to knock foes flying.",#358,Chimecho
"The bunches of fruit around TROPIUS’s neck are very popular with children. This POKéMON loves fruit, and eats it continuously. Apparently, its love for fruit resulted in its own outgrowth of fruit.",#357,Tropius
"DUSCLOPS’s body is completely hollow - there is nothing at all inside. It is said that its body is like a black hole. This POKéMON will absorb anything into its body, but nothing will ever come back out.",#356,Dusclops
"DUSKULL can pass through any wall no matter how thick it may be. Once this POKéMON chooses a target, it will doggedly pursue the intended victim until the break of dawn.",#355,Duskull
BANETTE generates energy for laying strong curses by sticking pins into its own body. This POKéMON was originally a pitiful plush doll that was thrown away.,#354,Banette
"SHUPPET is attracted by feelings of jealousy and vindictiveness. If someone develops strong feelings of vengeance, this POKéMON will appear in a swarm and line up beneath the eaves of that person’s home.",#353,Shuppet
KECLEON is capable of changing its body colors at will to blend in with its surroundings. There is one exception - this POKéMON can’t change the zigzag pattern on its belly.,#352,Kecleon
CASTFORM’s appearance changes with the weather. This POKéMON gained the ability to use the vast power of nature to protect its tiny body.,#351,Castform
MILOTIC is said to be the most beautiful of all the POKéMON. It has the power to becalm such emotions as anger and hostility to quell bitter feuding.,#350,Milotic
"FEEBAS’s fins are ragged and tattered from the start of its life. Because of its shoddy appearance, this POKéMON is largely ignored. It is capable of living in both the sea and in rivers.",#349,Feebas
ARMALDO’s tough armor makes all attacks bounce off. This POKéMON’s two enormous claws can be freely extended or contracted. They have the power to punch right through a steel slab.,#348,Armaldo
ANORITH was regenerated from a prehistoric fossil. This primitive POKéMON once lived in warm seas. It grips its prey firmly between its two large claws.,#347,Anorith
CRADILY roams around the ocean floor in search of food. This POKéMON freely extends its tree trunk-like neck and captures unwary prey using its eight tentacles.,#346,Cradily
LILEEP became extinct approximately a hundred million years ago. This ancient POKéMON attaches itself to a rock on the seafloor and catches approaching prey using tentacles shaped like flower petals.,#345,Lileep
CLAYDOL are said to be dolls of mud made by primitive humans and brought to life by exposure to a mysterious ray. This POKéMON moves about while levitating.,#344,Claydol
BALTOY moves while spinning around on its one foot. Primitive wall paintings depicting this POKéMON living among people were discovered in some ancient ruins.,#343,Baltoy
"CRAWDAUNT has an extremely violent nature that compels it to challenge other living things to battle. Other life-forms refuse to live in ponds inhabited by this POKéMON, making them desolate places.",#342,Crawdaunt
CORPHISH were originally foreign POKéMON that were imported as pets. They eventually turned up in the wild. This POKéMON is very hardy and has greatly increased its population.,#341,Corphish
"WHISCASH is extremely territorial. Just one of these POKéMON will claim a large pond as its exclusive territory. If a foe approaches it, it thrashes about and triggers a massive earthquake.",#340,Whiscash
"BARBOACH’s sensitive whiskers serve as a superb radar system. This POKéMON hides in mud, leaving only its two whiskers exposed while it waits for prey to come along.",#339,Barboach
"SOLROCK is a new species of POKéMON that is said to have fallen from space. It floats in air and moves silently. In battle, this POKéMON releases intensely bright light.",#338,Solrock
"LUNATONE was discovered at a location where a meteorite fell. As a result, some people theorize that this POKéMON came from space. However, no one has been able to prove this theory so far.",#337,Lunatone
SEVIPER shares a generations-long feud with ZANGOOSE. The scars on its body are evidence of vicious battles. This POKéMON attacks using its sword-edged tail.,#336,Seviper
Memories of battling its arch-rival SEVIPER are etched into every cell of ZANGOOSE’s body. This POKéMON adroitly dodges attacks with incredible agility.,#335,Zangoose
"ALTARIA dances and wheels through the sky among billowing, cotton-like clouds. By singing melodies in its crystal-clear voice, this POKéMON makes its listeners experience dreamy wonderment.",#334,Altaria
SWABLU has light and fluffy wings that are like cottony clouds. This POKéMON is not frightened of people. It lands on the heads of people and sits there like a cotton-fluff hat.,#333,Swablu
"During the daytime, CACTURNE remains unmoving so that it does not lose any moisture to the harsh desert sun. This POKéMON becomes active at night when the temperature drops.",#332,Cacturne
"CACNEA lives in arid locations such as deserts. It releases a strong aroma from its flower to attract prey. When prey comes near, this POKéMON shoots sharp thorns from its body to bring the victim down.",#331,Cacnea
"FLYGON is nicknamed “the elemental spirit of the desert.” Because its flapping wings whip up a cloud of sand, this POKéMON is always enveloped in a sandstorm while flying.",#330,Flygon
"To make prey faint, VIBRAVA generates ultrasonic waves by vigorously making its two wings vibrate. This POKéMON’s ultrasonic waves are so powerful, they can bring on headaches in people.",#329,Vibrava
"TRAPINCH’s nest is a sloped, bowl-like pit dug in sand. This POKéMON patiently waits for prey to tumble down the pit. Its giant jaws have enough strength to crush even boulders.",#328,Trapinch
"All the SPINDA that exist in the world are said to have utterly unique spot patterns. The shaky, tottering steps of this POKéMON give it the appearance of dancing.",#327,Spinda
"GRUMPIG uses the black pearls on its body to amplify its psychic power waves for gaining total control over its foe. When this POKéMON uses its special power, its snorting breath grows labored.",#326,Grumpig
"SPOINK bounces around on its tail. The shock of its bouncing makes its heart pump. As a result, this POKéMON cannot afford to stop bouncing - if it stops, its heart will stop.",#325,Spoink
"TORKOAL digs through mountains in search of coal. If it finds some, it fills hollow spaces on its shell with the coal and burns it. If it is attacked, this POKéMON spouts thick black smoke to beat a retreat.",#324,Torkoal
"CAMERUPT has a volcano inside its body. Magma of 18,000 degrees F courses through its body. Occasionally, the humps on this POKéMON’s back erupt, spewing the superheated magma.",#323,Camerupt
"NUMEL is extremely dull witted - it doesn’t notice being hit. However, it can’t stand hunger for even a second. This POKéMON’s body is a seething cauldron of boiling magma.",#322,Numel
"WAILORD is the largest of all identified POKéMON up to now. This giant POKéMON swims languorously in the vast open sea, eating massive amounts of food at once with its enormous mouth.",#321,Wailord
WAILMER’s nostrils are located above its eyes. This playful POKéMON loves to startle people by forcefully snorting out seawater it stores inside its body out of its nostrils.,#320,Wailmer
"Nicknamed “the bully of the sea,” SHARPEDO is widely feared. Its cruel fangs grow back immediately if they snap off. Just one of these POKéMON can thoroughly tear apart a supertanker.",#319,Sharpedo
CARVANHA’s strongly developed jaws and its sharply pointed fangs pack the destructive power to rip out boat hulls. Many boats have been attacked and sunk by this POKéMON.,#318,Carvanha
"When SWALOT spots prey, it spurts out a hideously toxic fluid from its pores and sprays the target. Once the prey has weakened, this POKéMON gulps it down whole with its cavernous mouth.",#317,Swalot
"Virtually all of GULPIN’s body is its stomach. As a result, it can swallow something its own size. This POKéMON’s stomach contains a special fluid that digests anything.",#316,Gulpin
ROSELIA shoots sharp thorns as projectiles at any opponent that tries to steal the flowers on its arms. The aroma of this POKéMON brings serenity to living things.,#315,Roselia
"ILLUMISE attracts a swarm of VOLBEAT using a sweet fragrance. Once the VOLBEAT have gathered, this POKéMON leads the lit-up swarm in drawing geometric designs on the canvas of the night sky.",#314,Illumise
"With the arrival of night, VOLBEAT emits light from its tail. It communicates with others by adjusting the intensity and flashing of its light. This POKéMON is attracted by the sweet aroma of ILLUMISE.",#313,Volbeat
MINUN is more concerned about cheering on its partners than its own safety. It shorts out the electricity in its body to create brilliant showers of sparks to cheer on its teammates.,#312,Minun
"PLUSLE always acts as a cheerleader for its partners. Whenever a teammate puts out a good effort in battle, this POKéMON shorts out its body to create the crackling noises of sparks to show its joy.",#311,Plusle
"MANECTRIC is constantly discharging electricity from its mane. The sparks sometimes ignite forest fires. When it enters a battle, this POKéMON creates thunderclouds.",#310,Manectric
ELECTRIKE stores electricity in its long body hair. This POKéMON stimulates its leg muscles with electric charges. These jolts of power give its legs explosive acceleration performance.,#309,Electrike
"It is said that through meditation, MEDICHAM heightens energy inside its body and sharpens its sixth sense. This POKéMON hides its presence by merging itself with fields and mountains.",#308,Medicham
"MEDITITE undertakes rigorous mental training deep in the mountains. However, whenever it meditates, this POKéMON always loses its concentration and focus. As a result, its training never ends.",#307,Meditite
AGGRON claims an entire mountain as its own territory. It mercilessly beats up anything that violates its environment. This POKéMON vigilantly patrols its territory at all times.,#306,Aggron
LAIRON tempers its steel body by drinking highly nutritious mineral springwater until it is bloated. This POKéMON makes its nest close to springs of delicious water.,#305,Lairon
"This POKéMON has a body of steel. To make its body, ARON feeds on iron ore that it digs from mountains. Occasionally, it causes major trouble by eating bridges and rails.",#304,Aron
"MAWILE’s huge jaws are actually steel horns that have been transformed. Its docile-looking face serves to lull its foe into letting down its guard. When the foe least expects it, MAWILE chomps it with its gaping jaws.",#303,Mawile
"SABLEYE lead quiet lives deep inside caverns. They are feared, however, because these POKéMON are thought to steal the spirits of people when their eyes burn with a sinister glow in the darkness.",#302,Sableye
"DELCATTY prefers to live an unfettered existence in which it can do as it pleases at its own pace. Because this POKéMON eats and sleeps whenever it decides, its daily routines are completely random.",#301,Delcatty
SKITTY has the habit of becoming fascinated by moving objects and chasing them around. This POKéMON is known to chase after its own tail and become dizzy.,#300,Skitty
"NOSEPASS’s magnetic nose is always pointed to the north. If two of these POKéMON meet, they cannot turn their faces to each other when they are close because their magnetic noses repel one another.",#299,Nosepass
"AZURILL spins its tail as if it were a lasso, then hurls it far. The momentum of the throw sends its body flying, too. Using this unique action, one of these POKéMON managed to hurl itself a record 33 feet.",#298,Azurill
"HARIYAMA practices its straight-arm slaps in any number of locations. One hit of this POKéMON’s powerful, openhanded, straight-arm punches could snap a telephone pole in two.",#297,Hariyama
"MAKUHITA is tenacious - it will keep getting up and attacking its foe however many times it is knocked down. Every time it gets back up, this POKéMON stores more energy in its body for evolving.",#296,Makuhita
"EXPLOUD triggers earthquakes with the tremors it creates by bellowing. If this POKéMON violently inhales from the ports on its body, it’s a sign that it is preparing to let loose a huge bellow.",#295,Exploud
LOUDRED’s bellowing can completely decimate a wood-frame house. It uses its voice to punish its foes. This POKéMON’s round ears serve as loudspeakers.,#294,Loudred
"Normally, WHISMUR’s voice is very quiet - it is barely audible even if one is paying close attention. However, if this POKéMON senses danger, it starts crying at an earsplitting volume.",#293,Whismur
"SHEDINJA’s hard body doesn’t move - not even a twitch. In fact, its body appears to be merely a hollow shell. It is believed that this POKéMON will steal the spirit of anyone peering into its hollow body from its back.",#292,Shedinja
"NINJASK moves around at such a high speed that it cannot be seen, even while its crying can be clearly heard. For that reason, this POKéMON was long believed to be invisible.",#291,Ninjask
NINCADA lives underground for many years in complete darkness. This POKéMON absorbs nutrients from the roots of trees. It stays motionless as it waits for evolution.,#290,Nincada
"SLAKING spends all day lying down and lolling about. It eats grass growing within its reach. If it eats all the grass it can reach, this POKéMON reluctantly moves to another spot.",#289,Slaking
"SLAKOTH lolls around for over twenty hours every day. Because it moves so little, it does not need much food. This POKéMON’s sole daily meal consists of just three leaves.",#287,Slakoth
VIGOROTH is always itching and agitated to go on a wild rampage. It simply can’t tolerate sitting still for even a minute. This POKéMON’s stress level rises if it can’t be moving constantly.,#288,Vigoroth
"BRELOOM closes in on its foe with light and sprightly footwork, then throws punches with its stretchy arms. This POKéMON’s fighting technique puts boxers to shame.",#286,Breloom
"SHROOMISH live in damp soil in the dark depths of forests. They are often found keeping still under fallen leaves. This POKéMON feeds on compost that is made up of fallen, rotted leaves.",#285,Shroomish
MASQUERAIN intimidates enemies with the eyelike patterns on its antennas. This POKéMON flaps its four wings to freely fly in any direction - even sideways and backwards - as if it were a helicopter.,#284,Masquerain
"From the tips of its feet, SURSKIT secretes an oil that enables it to walk on water as if it were skating. This POKéMON feeds on microscopic organisms in ponds and lakes.",#283,Surskit
"GARDEVOIR has the ability to read the future. If it senses impending danger to its TRAINER, this POKéMON is said to unleash its psychokinetic energy at full power.",#282,Gardevoir
It is said that a KIRLIA that is exposed to the positive emotions of its TRAINER grows beautiful. This POKéMON controls psychokinetic powers with its highly developed brain.,#281,Kirlia
"RALTS senses the emotions of people using the horns on its head. This POKéMON rarely appears before people. But when it does, it draws closer if it senses that the person has a positive disposition.",#280,Ralts
PELIPPER is a flying transporter that carries small POKéMON and eggs inside its massive bill. This POKéMON builds its nest on steep cliffs facing the sea.,#279,Pelipper
WINGULL has the habit of carrying prey and valuables in its beak and hiding them in all sorts of locations. This POKéMON rides the winds and flies as if it were skating across the sky.,#278,Wingull
"SWELLOW flies high above our heads, making graceful arcs in the sky. This POKéMON dives at a steep angle as soon as it spots its prey. The hapless prey is tightly grasped by SWELLOW’s clawed feet, preventing escape.",#277,Swellow
"TAILLOW courageously stands its ground against foes, however strong they may be. This gutsy POKéMON will remain defiant even after a loss. On the other hand, it cries loudly if it becomes hungry.",#276,Taillow
SHIFTRY is a mysterious POKéMON that is said to live atop towering trees dating back over a thousand years. It creates terrific windstorms with the fans it holds.,#275,Shiftry
NUZLEAF live in densely overgrown forests. They occasionally venture out of the forest to startle people. This POKéMON dislikes having its long nose pinched.,#274,Nuzleaf
"LUDICOLO begins dancing as soon as it hears cheerful, festive music. This POKéMON is said to appear when it hears the singing of children on hiking outings.",#272,Ludicolo
"SEEDOT attaches itself to a tree branch using the top of its head. It sucks moisture from the tree while hanging off the branch. The more water it drinks, the glossier this POKéMON’s body becomes.",#273,Seedot
"LOMBRE is nocturnal - it will get active after dusk. It is also a mischief-maker. When this POKéMON spots anglers, it tugs on their fishing lines from beneath the surface and enjoys their consternation.",#271,Lombre
"LOTAD live in ponds and lakes, where they float on the surface. It grows weak if its broad leaf dies. On rare occasions, this POKéMON travels on land in search of clean water.",#270,Lotad
"DUSTOX is instinctively drawn to light. Swarms of this POKéMON are attracted by the bright lights of cities, where they wreak havoc by stripping the leaves off roadside trees for food.",#269,Dustox
"CASCOON makes its protective cocoon by wrapping its body entirely with a fine silk from its mouth. Once the silk goes around its body, it hardens. This POKéMON prepares for its evolution inside the cocoon.",#268,Cascoon
"BEAUTIFLY’s favorite food is the sweet pollen of flowers. If you want to see this POKéMON, just leave a potted flower by an open window. BEAUTIFLY is sure to come looking for pollen.",#267,Beautifly
