Pokedex Entry,Number,Name
"They crush berries with their talons. They bravely stand up to any opponent, no matter how strong it is.",#627,Rufflet
"Their fluffy fur absorbs damage, even if they strike foes with a fierce headbutt.",#626,Bouffalant
"It leads a group of Pawniard. It battles to become the boss, but will be driven from the group if it loses.",#625,Bisharp
"Blades comprise this Pokémon’s entire body. If battling dulls the blades, it sharpens them on stones by the river.",#624,Pawniard
It flies across the sky at Mach speeds. Removing the seal on its chest makes its internal energy go out of control.,#623,Golurk
"The energy that burns inside it enables it to move, but no one has yet been able to identify this energy.",#622,Golett
"It warms its body by absorbing sunlight with its wings. When its body temperature falls, it can no longer move.",#621,Druddigon
It wields the fur on its arms like a whip. Its arm attacks come with such rapidity that they cannot even be seen.,#620,Mienshao
"In fights, they dominate with onslaughts of flowing, continuous attacks. With their sharp claws, they cut enemies.",#619,Mienfoo
"Its skin is very hard, so it is unhurt even if stepped on by sumo wrestlers. It smiles when transmitting electricity.",#618,Stunfisk
"When its body dries out, it weakens. So, to prevent dehydration, it wraps itself in many layers of thin membrane.",#617,Accelgor
"When attacked, it defends itself by closing the lid of its shell. It can spit a sticky, poisonous liquid.",#616,Shelmet
"When its body temperature goes up, it turns into steam and vanishes. When its temperature lowers, it returns to ice.",#615,Cryogonal
"It can make its breath freeze at will. Very able in the water, it swims around in northern seas and catches prey.",#614,Beartic
"When it is not feeling well, its mucus gets watery and the power of its Ice-type moves decreases.",#613,Cubchoo
They are kind but can be relentless when defending territory. They challenge foes with tusks that can cut steel.,#612,Haxorus
"Since a broken tusk will not grow back, they diligently sharpen their tusks on river rocks after they’ve been fighting.",#611,Fraxure
They use their tusks to crush the berries they eat. Repeated regrowth makes their tusks strong and sharp.,#610,Axew
"It absorbs a spirit, which it then burns. By waving the flames on its arms, it puts its foes into a hypnotic trance.",#609,Chandelure
"This ominous Pokémon is feared. Through cities it wanders, searching for the spirits of the fallen.",#608,Lampent
"Litwick shines a light that absorbs the life energy of people and Pokémon, which becomes the fuel that it burns.",#607,Litwick
"It can manipulate an opponent’s memory. Apparently, it communicates by flashing its three different-colored fingers.",#606,Beheeyem
"It uses its strong psychic power to squeeze its opponent’s brain, causing unendurable headaches.",#605,Elgyem
They crawl out of the ocean using their arms. They will attack prey on shore and immediately drag it into the ocean.,#604,Eelektross
They coil around foes and shock them with electricity-generating organs that seem simply to be circular patterns.,#603,Eelektrik
"While one alone doesn’t have much power, a chain of many Tynamo can be as powerful as lightning.",#602,Tynamo
Its red core functions as an energy tank. It fires the charged energy through its spikes into an area.,#601,Klinklang
"By changing the direction in which it rotates, it communicates its feelings to others. When angry, it rotates faster.",#600,Klang
The two minigears that mesh together are predetermined. Each will rebound from other minigears without meshing.,#599,Klink
It fights by swinging around its three spiky feelers. A hit from these steel spikes can reduce a boulder to rubble.,#598,Ferrothorn
"When threatened, it attacks by shooting a barrage of spikes, which gives it a chance to escape by rolling away.",#597,Ferroseed
"When attacked, they create an electric barrier by spitting out many electrically charged threads.",#596,Galvantula
Joltik that live in cities have learned a technique for sucking electricity from the outlets in houses.,#595,Joltik
The special membrane enveloping Alomomola has the ability to heal wounds.,#594,Alomomola
"The fate of the ships and crew that wander into Jellicent’s habitat: all sunken, all lost, all vanished.",#593,Jellicent
"With its thin, veil-like arms wrapped around the body of its opponent, it sinks to the ocean floor.",#592,Frillish
"It lures prey close by dancing and waving its arm caps, which resemble Poké Balls, in a swaying motion.",#591,Amoonguss
"It lures people in with its Poké Ball pattern, then releases poison spores. Why it resembles a Poké Ball is unknown.",#590,Foongus
"They fly around at high speed, striking with their pointed spears. Even when in trouble, they face opponents bravely.",#589,Escavalier
These mysterious Pokémon evolve when they receive electrical stimulation while they are in the same place as Shelmet.,#588,Karrablast
The energy made in its cheeks’ electric pouches is stored inside its membrane and released while it is gliding.,#587,Emolga
They migrate according to the seasons. People can tell the season by looking at Sawsbuck’s horns.,#586,Sawsbuck
"The color and scent of their fur changes to match the mountain grass. When they sense hostility, they hide in the grass.",#585,Deerling
"Swallowing large amounts of water, they make snow clouds inside their bodies and attack their foes with violent blizzards.",#584,Vanilluxe
"Snowy mountains are this Pokémon’s habitat. During an ancient ice age, they moved to southern areas.",#583,Vanillish
The temperature of their breath is -58° F. They create snow crystals and make snow fall in the areas around them.,#582,Vanillite
Swanna start to dance at dusk. The one dancing in the middle is the leader of the flock.,#581,Swanna
"When Reuniclus shake hands, a network forms between their brains, increasing their psychic power.",#579,Reuniclus
These bird Pokémon are excellent divers. They swim around in the water eating their favorite food--peat moss.,#580,Ducklett
"Since they have two divided brains, at times they suddenly try to take two different actions at once.",#578,Duosion
They drive away attackers by unleashing psychic power. They can use telepathy to talk with others.,#577,Solosis
Starry skies thousands of light-years away are visible in the space distorted by their intense psychic power.,#576,Gothitelle
They use hypnosis to control people and Pokémon. Tales of Gothorita leading people astray are told in every corner.,#575,Gothorita
Their ribbonlike feelers increase their psychic power. They are always staring at something.,#574,Gothita
Their white fur is coated in a special oil that makes it easy for them to deflect attacks.,#573,Cinccino
"They greet one another by rubbing each other with their tails, which are always kept well groomed and clean.",#572,Minccino
Bonds between these Pokémon are very strong. It protects the safety of its pack by tricking its opponents.,#571,Zoroark
"It changes into the forms of others to surprise them. Apparently, it often transforms into a silent child.",#570,Zorua
It clenches opponents with its left arm and finishes them off with foul-smelling poison gas belched from its mouth.,#569,Garbodor
Inhaling the gas they belch will make you sleep for a week. They prefer unsanitary places.,#568,Trubbish
"They are intelligent and will cooperate to catch prey. From the ground, they use a running start to take flight.",#567,Archeops
"Said to be an ancestor of bird Pokémon, they were unable to fly and moved about by hopping from one branch to another.",#566,Archen
They can live both in the ocean and on land. A slap from one of them is enough to open a hole in the bottom of a tanker.,#565,Carracosta
"Restored from a fossil, this Pokémon can dive to depths beyond half a mile.",#564,Tirtouga
It has been said that they swallow those who get too close and turn them into mummies. They like to eat gold nuggets.,#563,Cofagrigus
Each of them carries a mask that used to be its face when it was human. Sometimes they look at it and cry.,#562,Yamask
"They never vary the route they fly, because their memories of guarding an ancient city remain steadfast.",#561,Sigilyph
Groups of them beat up anything that enters their territory. Each can spit acidic liquid from its mouth.,#560,Scrafty
"Its skin has a rubbery elasticity, so it can reduce damage by defensively pulling its skin up to its neck.",#559,Scraggy
"Competing for territory, Crustle fight viciously. The one whose boulder is broken is the loser of the battle.",#558,Crustle
This Pokémon can easily melt holes in hard rocks with a liquid secreted from its mouth.,#557,Dwebble
It uses an up-tempo song and dance to drive away the bird Pokémon that prey on its flower seeds.,#556,Maractus
"Its internal fire burns at 2,500° F, making enough power that it can destroy a dump truck with one punch.",#555,Darmanitan
"When its internal fire is burning, it cannot calm down and it runs around. When the fire diminishes, it falls asleep.",#554,Darumaka
"They never allow prey to escape. Their jaws are so powerful, they can crush the body of an automobile.",#553,Krookodile
They live in groups of a few individuals. Protective membranes shield their eyes from sandstorms.,#552,Krokorok
They live buried in the sands of the desert. The sun-warmed sands prevent their body temperature from dropping.,#551,Sandile
"Red and blue Basculin get along so poorly, they’ll start fighting instantly. These Pokémon are very hostile.",#550,Basculin
Even veteran Trainers face a challenge in getting its beautiful flower to bloom. This Pokémon is popular with celebrities.,#549,Lilligant
The leaves on its head are very bitter. Eating one of these leaves is known to refresh a tired body.,#548,Petilil
"Like the wind, it can slip through any gap, no matter how small. It leaves balls of white fluff behind.",#547,Whimsicott
"With quick movements, it chases down its foes, attacking relentlessly with its horns until it prevails.",#545,Scolipede
"When attacked, it escapes by shooting cotton from its body. The cotton serves as a decoy to distract the attacker.",#546,Cottonee
"Protected by a hard shell, it spins its body like a wheel and crashes furiously into its enemies.",#544,Whirlipede
"Its bite injects a potent poison, enough to paralyze large bird Pokémon that try to prey on it.",#543,Venipede
"Upon finding a small Pokémon, it weaves clothing for it from leaves, using the cutters on its arms and sticky silk.",#542,Leavanny
Forests where Swadloon live have superb foliage because the nutrients they make from fallen leaves nourish the plant life.,#541,Swadloon
Leavanny dress it in clothes they made for it when it hatched. It hides its head in its hood while it is sleeping.,#540,Sewaddle
The sound of Sawk punching boulders and trees can be heard all the way from the mountains where they train.,#539,Sawk
"When it tightens its belt, it becomes stronger. Wild Throh use vines to weave their own belts.",#538,Throh
They shoot paralyzing liquid from their head bumps. They use vibration to hurt their opponents.,#537,Seismitoad
"When they vibrate the bumps on their heads, they can make waves in water or earthquake-like vibrations on land.",#536,Palpitoad
They warn others of danger by vibrating their cheeks to create a high-pitched sound.,#535,Tympole
"It is thought that Conkeldurr taught humans how to make concrete more than 2,000 years ago.",#534,Conkeldurr
This Pokémon is so muscular and strongly built that even a group of wrestlers could not make it budge an inch.,#533,Gurdurr
It fights by swinging a piece of lumber around. It is close to evolving when it can handle the lumber without difficulty.,#532,Timburr
"It touches others with the feelers on its ears, using the sound of their heartbeats to tell how they are feeling.",#531,Audino
It can help in tunnel construction. Its drill has evolved into steel strong enough to bore through iron plates.,#530,Excadrill
It can dig through the ground at a speed of 30 mph. It could give a car running aboveground a good race.,#529,Drilbur
"It emits sound waves of various frequencies from its nose, including some powerful enough to destroy rocks.",#528,Swoobat
Its habitat is dark forests and caves. It emits ultrasonic waves from its nose to learn about its surroundings.,#527,Woobat
Compressing the energy from its internal core lets it fire off an attack capable of blowing away a mountain.,#526,Gigalith
"When it overflows with power, the orange crystal on its body glows. It looks for underground water in caves.",#525,Boldore
"Its ear is hexagonal in shape. Compressed underground, its body is as hard as steel.",#524,Roggenrola
"They have lightning-like movements. When Zebstrika run at full speed, the sound of thunder reverberates.",#523,Zebstrika
Its mane shines when it discharges electricity. They use their flashing manes to communicate with one another.,#522,Blitzle
Males swing their head plumage to threaten opponents. The females’ flying abilities surpass those of the males.,#521,Unfezant
It can return to its Trainer’s location regardless of the distance separating them.,#520,Tranquill
"Each follows its Trainer’s orders as best it can, but they sometimes fail to understand complicated commands.",#519,Pidove
The mist emanating from their foreheads is packed with the dreams of people and Pokémon.,#518,Musharna
Munna always float in the air. People whose dreams are eaten by them forget what the dreams had been about.,#517,Munna
"The tuft on its head holds water. When the level runs low, it replenishes the tuft by siphoning up water with its tail.",#516,Simipour
The water stored inside the tuft on its head is full of nutrients. Plants that receive its water grow large.,#515,Panpour
It loves sweets because they become energy for the fire burning inside its body.,#514,Simisear
"Ill tempered, it fights by swinging its barbed tail around wildly. The leaf growing on its head is very bitter.",#512,Simisage
"When it is angered, the temperature of its head tuft reaches 600° F. It uses its tuft to roast berries.",#513,Pansear
This Pokémon dwells deep in the forest. Eating a leaf from its head whisks weariness away as if by magic.,#511,Pansage
These Pokémon vanish and appear unexpectedly. Many Trainers are drawn to their beautiful form and fur.,#510,Liepard
"They steal from people for fun, but their victims can’t help but forgive them. Their deceptively cute act is perfect.",#509,Purrloin
It rescues people stranded by blizzards in the mountains. Its shaggy fur shields it from the cold.,#508,Stoutland
"It has black, cape-like fur that is very hard and decreases the amount of damage it receives.",#507,Herdier
"It faces strong opponents with great courage. But, when at a disadvantage in a fight, this intelligent Pokémon flees.",#506,Lillipup
"When they see an enemy, their tails stand high, and they spit the seeds of berries stored in their cheek pouches.",#505,Watchog
"Using food stored in cheek pouches, they can keep watch for days. They use their tails to communicate with others.",#504,Patrat
One swing of the sword incorporated in its armor can fell an opponent. A simple glare from one of them quiets everybody.,#503,Samurott
Strict training is how it learns its flowing double-scalchop technique.,#502,Dewott
"It fights using the scalchop on its stomach. In response to an attack, it retaliates immediately by slashing.",#501,Oshawott
"When its internal fire flares up, its movements grow sharper and faster. When in trouble, it emits smoke.",#499,Pignite
It can throw a fire punch by setting its fists on fire with its fiery chin. It cares deeply about its friends.,#500,Emboar
It can deftly dodge its foe’s attacks while shooting fireballs from its nose. It roasts berries before it eats them.,#498,Tepig
It can stop its opponents’ movements with just a glare. It takes in solar energy and boosts it internally.,#497,Serperior
"It moves along the ground as if sliding. Its swift movements befuddle its foes, and it then attacks with a vine whip.",#496,Servine
It is very intelligent and calm. Being exposed to lots of sunlight makes its movements swifter.,#495,Snivy
"This Pokémon brings victory. It is said that Trainers with Victini always win, regardless of the type of encounter.",#494,Victini
"It is described in mythology as the Pokémon that shaped the universe with its 1,000 arms.",#493,Arceus
It lives in flower patches and avoids detection by curling up to look like a flowering plant.,#492,Shaymin
It can lull people to sleep and make them dream. It is active during nights of the new moon.,#491,Darkrai
"Born on a cold seafloor, it will swim great distances to return to its birthplace.",#490,Manaphy
A Pokémon that lives in warm seas. It inflates the flotation sac on its head to drift and search for food.,#489,Phione
Shiny particles are released from its wings like a veil. It is said to represent the crescent moon.,#488,Cresselia
A Pokémon that is said to live in a world on the reverse side of ours. It appears in an ancient cemetery.,#487,Giratina
There is an enduring legend that states this Pokémon towed continents with ropes.,#486,Regigigas
It dwells in volcanic caves. It digs in with its cross-shaped feet to crawl on ceilings and walls.,#485,Heatran
It has the ability to distort space. It is described as a deity in Sinnoh-region mythology.,#484,Palkia
It has the power to control time. It appears in Sinnoh-region myths as an ancient deity.,#483,Dialga
Known as “The Being of Willpower.” It sleeps at the bottom of a lake to keep the world in balance.,#482,Azelf
"Known as “The Being of Emotion.” It taught humans the nobility of sorrow, pain, and joy.",#481,Mesprit
Known as “The Being of Knowledge.” It is said that it can wipe out the memory of those who see its eyes.,#480,Uxie
Its body is composed of plasma. It is known to infiltrate electronic devices and wreak havoc.,#479,Rotom
It freezes foes with an icy breath nearly -60 degrees F. What seems to be its body is actually hollow.,#478,Froslass
The antenna on its head captures radio waves from the world of spirits that command it to take people there.,#477,Dusknoir
It exudes strong magnetism from all over. It controls three small units called Mini-Noses.,#476,Probopass
"A master of courtesy and swordsmanship, it fights using extending swords on its elbows.",#475,Gallade
"Additional software was installed to make it a better Pokémon. It began acting oddly, however.",#474,Porygon-Z
Its impressive tusks are made of ice. The population thinned when it turned warm after the ice age.,#473,Mamoswine
"It observes prey while hanging inverted from branches. When the chance presents itself, it swoops!",#472,Gliscor
"As a protective technique, it can completely freeze its fur to make its hairs stand like needles.",#471,Glaceon
"Just like a plant, it uses photosynthesis. As a result, it is always enveloped in clear air.",#470,Leafeon
"By churning its wings, it creates shock waves that inflict critical internal injuries to foes.",#469,Yanmega
It will never appear where there is strife. Its sightings have become rare recently.,#468,Togekiss
"It blasts fireballs of over 3,600 degrees F from the ends of its arms. It lives in volcanic craters.",#467,Magmortar
"It pushes the tips of its two tails against the foe, then lets loose with over 20,000 volts of power.",#466,Electivire
It ensnares prey by extending arms made of vines. Losing arms to predators does not trouble it.,#465,Tangrowth
It puts rocks in holes in its palms and uses its muscles to shoot them. GEODUDE are shot at rare times.,#464,Rhyperior
It wraps things with its extensible tongue. Getting too close to it will leave you soaked with drool.,#463,Lickilicky
It evolved from exposure to a special magnetic field. Three units generate magnetism.,#462,Magnezone
"They live in cold regions, forming groups of four or five that hunt prey with impressive coordination.",#461,Weavile
It whips up blizzards in mountains that are always buried in snow. It is the abominable snowman.,#460,Abomasnow
"It lives on snowy mountains. Having had little contact with humans, it is boldly inquisitive.",#459,Snover
A friendly Pokémon that captures the subtle flows of seawater using its two antennae.,#458,Mantyke
"After long exposure to sunlight, the patterns on its tail fins shine vividly when darkness arrives.",#456,Finneon
It lives on the deep-sea floor. It attracts prey by flashing the patterns on its four tail fins.,#457,Lumineon
"It attracts prey with its sweet-smelling saliva, then chomps down. It takes a whole day to eat prey.",#455,Carnivine
Its knuckle claws secrete a toxin so vile that even a scratch could prove fatal.,#454,Toxicroak
Its cheeks hold poison sacs. It tries to catch foes off guard to jab them with toxic fingers.,#453,Croagunk
It has the power in its clawed arms to make scrap of a car. The tips of its claws release poison.,#452,Drapion
It grips prey with its tail claws and injects poison. It tenaciously hangs on until the poison takes.,#451,Skorupi
It blasts internally stored sand from ports on its body to create a towering twister for attack.,#450,Hippowdon
"It lives in arid places. Instead of perspiration, it expels grainy sand from its body.",#449,Hippopotas
It has the ability to sense the auras of all things. It understands human speech.,#448,Lucario
The aura that emanates from its body intensifies to alert others if it is afraid or sad.,#447,Riolu
"It wolfs down its weight in food once a day, swallowing food whole with almost no chewing.",#446,Munchlax
"When it folds up its body and extends its wings, it looks like a jet plane. It flies at sonic speed.",#445,Garchomp
There is a long-held belief that medicine made from its scales will heal even incurable illnesses.,#444,Gabite
"It nests in small, horizontal holes in cave walls. It pounces to catch prey that stray too close.",#443,Gible
A Pokémon that was formed by 108 spirits. It is bound to a fissure in an odd keystone.,#442,Spiritomb
"It can learn and speak human words. If they gather, they all learn the same saying.",#441,Chatot
It loves round white things. It carries an egg-shaped rock in imitation of CHANSEY.,#440,Happiny
"It habitually mimics foes. Once mimicked, the foe cannot take its eyes off this Pokémon.",#439,Mime Jr.
It looks as if it is always crying. It is actually adjusting its body’s fluid levels by eliminating excess.,#438,Bonsly
"One caused a news sensation when it was dug up at a construction site after a 2,000-year sleep.",#437,Bronzong
Implements shaped like it were discovered in ancient tombs. It is unknown if they are related.,#436,Bronzor
It sprays a vile-smelling fluid from the tip of its tail to attack. Its range is over 160 feet.,#435,Skuntank
It protects itself by spraying a noxious fluid from its rear. The stench lingers for 24 hours.,#434,Stunky
It emits cries by agitating an orb at the back of its throat. It moves with flouncing hops.,#433,Chingling
It is a brazen brute that barges its way into another Pokémon’s nest and claims it as its own.,#432,Purugly
It claws if displeased and purrs when affectionate. Its fickleness is very popular among some.,#431,Glameow
"Becoming active at night, it is known to swarm with numerous MURKROW in tow.",#430,Honchkrow
Its cries sound like incantations. Those hearing it are tormented by headaches and hallucinations.,#429,Mismagius
An extremely cautious Pokémon. It cloaks its body with its fluffy ear fur when it senses danger.,#428,Lopunny
It slams foes by sharply uncoiling its rolled ears. It stings enough to make a grown-up cry in pain.,#427,Buneary
"A Pokémon formed by the spirits of people and Pokémon. It loves damp, humid seasons.",#425,Drifloon
"It’s drowzy in daytime, but flies off in the evening in big groups. No one knows where they go.",#426,Drifblim
"To eat, it deftly shucks nuts with its two tails. It rarely uses its arms now.",#424,Ambipom
"It has a pliable body without any bones. If any part of its body is torn off, it grows right back.",#423,Gastrodon
"Its colors and shapes differ from region to region. In the Sinnoh region, two types are confirmed.",#422,Shellos
It blooms during times of strong sunlight. It tries to make up for everything it endured as a bud.,#421,Cherrim
"The small ball holds the nutrients needed for evolution. Apparently, it is very sweet and tasty.",#420,Cherubi
It floats using its well-developed flotation sac. It assists in the rescues of drowning people.,#419,Floatzel
It has a flotation sac that is like an inflatable collar. It floats on water with its head out.,#418,Buizel
It makes fur balls that crackle with static electricity. It stores them with berries in tree holes.,#417,Pachirisu
Its abdomen is a honeycomb for grubs. It raises its grubs on honey collected by COMBEE.,#416,Vespiquen
A Pokémon formed by three others. It busily carries sweet floral honey to VESPIQUEN.,#415,Combee
It loves the honey of flowers and steals honey collected by COMBEE.,#414,Mothim
"When BURMY evolved, its cloak became a part of this Pokémon’s body. The cloak is never shed.",#413,Wormadam
"To shelter itself from cold, wintry winds, it covers itself with a cloak made of twigs and leaves.",#412,Burmy
Any frontal attack is repulsed. It is a docile Pokémon that feeds on grass and berries.,#411,Bastiodon
A Pokémon that lived in jungles around 100 million years ago. Its facial hide is extremely hard.,#410,Shieldon
Its powerful head butt has enough power to shatter even the most durable things upon impact.,#409,Rampardos
It lived in jungles around 100 million years ago. Its skull is as hard as iron.,#408,Cranidos
